{
  "$schema": "../../schema/program.schema.json",
  "code": "DEE_KY_THUAT_DIEN_2020",
  "name": "Kỹ thuật Điện",
  "nameEn": "Electrical Engineering",
  "faculty": "dee",
  "year": "2020",
  "source": "https://drive.google.com/file/d/17t2K6DxkY01RdVGbiqJ9hQyHV9K_8TSq/view",
  "blocks": [
    {
      "id": "K01",
      "name": "I. Các môn bắt buộc (Compulsary Courses ) 88",
      "required": true,
      "courses": [
        "MT1003",
        "MT1005",
        "MT1007",
        "MT2013",
        "CH1003",
        "PH1003",
        "PH1007",
        "EE1007",
        "MT1009",
        "SP1007",
        "SP1031",
        "SP1033",
        "SP1035",
        "SP1037",
        "SP1039"
      ]
    },
    {
      "id": "K02",
      "name": "Nhập môn về kỹ thuật Nhập môn",
      "group": "I. Các môn bắt buộc (Compulsary Courses ) 88",
      "required": true,
      "courses": [
        "EE1001",
        "EN1003",
        "LA1003",
        "LA1005",
        "LA1007",
        "LA1009",
        "EE1009",
        "EE2003",
        "EE2009",
        "EE2017",
        "EE2019",
        "EE2021",
        "EE2023",
        "EE2025",
        "EE2033",
        "EE2035",
        "EE2039",
        "EE3023",
        "EE3181"
      ]
    },
    {
      "id": "K03",
      "name": "(Tối thiểu 3 TC) Management for Engineers",
      "group": "II. Các môn bắt buộc và tự chọn của chuyên ngành 44",
      "required": false,
      "courses": [
        "EE3001",
        "EE3009",
        "EE3013",
        "EE3027",
        "EE3097",
        "EE3345",
        "EE4007",
        "EE4347"
      ]
    },
    {
      "id": "K04",
      "name": "Các môn tự chọn nhóm (Elective Courses - Group) A",
      "group": "II. Các môn bắt buộc và tự chọn của chuyên ngành 44",
      "required": false,
      "courses": [
        "EE3087",
        "EE3089",
        "EE3091",
        "EE3093",
        "EE3095",
        "EE3099",
        "EE3101",
        "EE3131",
        "EE3133",
        "EE3135",
        "EE3139"
      ]
    },
    {
      "id": "K05",
      "name": "Điều khiển và ứng dụng các bộ biến đổi công suất",
      "group": "II. Các môn bắt buộc và tự chọn của chuyên ngành 44",
      "required": false,
      "courses": [
        "EE3143",
        "EE3145",
        "EE3171",
        "EE3179",
        "EE4027",
        "EE4029"
      ]
    },
    {
      "id": "K06",
      "name": "Các môn tự chọn nhóm (Elective Courses - Group) B",
      "group": "II. Các môn bắt buộc và tự chọn của chuyên ngành 44",
      "required": false,
      "courses": [
        "IM1013"
      ]
    },
    {
      "id": "K07",
      "name": "Quản lý sản xuất cho kỹ sư",
      "group": "II. Các môn bắt buộc và tự chọn của chuyên ngành 44",
      "required": false,
      "courses": [
        "IM1023",
        "IM1025",
        "IM1027",
        "IM3001"
      ]
    }
  ],
  "updated": "2026-10-04"
}
