{
  "$schema": "../../schema/program.schema.json",
  "code": "FME_CONG_NGHE_DET_MAY_2019",
  "name": "Công nghệ Dệt, May",
  "nameEn": "Textile - Clothing Technology",
  "faculty": "fme",
  "year": "2019",
  "source": "https://drive.google.com/file/d/1IXpv_S5k7PRv-p9sUxn_gDAH4K3x7Y90/view",
  "blocks": [
    {
      "id": "K01",
      "name": "I. Các môn bắt buộc (Compulsary Courses) 83",
      "required": true,
      "courses": [
        "MT1003",
        "MT1005",
        "MT1007",
        "MT2013",
        "CH1003",
        "PH1003",
        "PH1007",
        "MT1009",
        "PH1005",
        "SP1007",
        "SP1031",
        "SP1033",
        "SP1035",
        "SP1037",
        "SP1039",
        "ME1001",
        "ME2019",
        "LA1003",
        "LA1005",
        "LA1007",
        "LA1009",
        "ME1003",
        "ME2065",
        "ME2101",
        "ME2103",
        "ME2107",
        "ME3173",
        "ME4105",
        "ME4111",
        "ME4125"
      ]
    },
    {
      "id": "K02",
      "name": "2 Các môn tự chọn nhóm (Elective Courses - Group) A (Tối thiểu 3 TC) 3 Quản lý",
      "group": "II. Các môn bắt buộc và tự chọn của chuyên ngành 48",
      "required": false,
      "courses": [
        "ME2033",
        "ME2105",
        "ME2109",
        "ME3095",
        "ME3105",
        "ME3115",
        "ME3137",
        "ME3175",
        "ME3177",
        "ME4123",
        "ME3133",
        "ME4121",
        "ME4357"
      ]
    },
    {
      "id": "K03",
      "name": "Các môn tự chọn nhóm (Elective Courses - Group) A",
      "group": "II. Các môn bắt buộc và tự chọn của chuyên ngành 48",
      "required": false,
      "courses": [
        "IM1013",
        "IM1023",
        "IM1025",
        "IM1027",
        "IM3001"
      ]
    },
    {
      "id": "K04",
      "name": "III. Chứng chỉ (Certification)",
      "required": false,
      "courses": [
        "MI1003",
        "PE1003",
        "PE1005",
        "PE1007"
      ]
    }
  ],
  "updated": "2026-10-04"
}
